<?xml version="1.0"?>
<xs:schema xmlns:xs="http://www.w3.org/2001/XMLSchema"
targetNamespace="http://www.w3schools.com"
xmlns="http://www.w3schools.com"
elementFormDefault="qualified">

<xs:include schemaLocation="global.xsd"/>

<xs:complexType name="parameterType">
	<xs:attribute name="name" type="parameterNameType" use="required"/>
	<xs:attribute name="value" type="xs:decimal" use="required"/>
</xs:complexType>
		
<xs:complexType name="parsetType">
	<xs:sequence>
		<xs:element name="Parameter" type="parameterType" minOccurs="1" maxOccurs="unbounded"/>
	</xs:sequence>
	<xs:attribute name="name" type="parametersetNameType" use="required"/>
</xs:complexType>

<xs:complexType name="parsetsType">
	<xs:sequence>
		<xs:element name="parameter-set" type="parsetType" minOccurs="1" maxOccurs="unbounded"/>
	</xs:sequence>
</xs:complexType>

<xs:element name="profile" type="parsetsType">
</xs:element>

</xs:schema>